{
  "$schema": "https://json-schema.org/draft/2020-12/schema",
  "$id": "https://example.invalid/moomooau/protected-ga-canonical-blob-attempt-ledger-v1.schema.json",
  "title": "MooMooAU protected GA canonical Git Blob attempt ledger v1",
  "type": "object",
  "additionalProperties": false,
  "required": [
    "schema_version",
    "stage_id",
    "task_id",
    "observed_through_utc",
    "predecessor_control",
    "attempts",
    "completion_policy",
    "claims"
  ],
  "properties": {
    "schema_version": {
      "const": "moomooau.protected-ga-canonical-blob-attempt-ledger.v1"
    },
    "stage_id": {
      "const": "S7"
    },
    "task_id": {
      "const": "T0705"
    },
    "observed_through_utc": {
      "const": "2026-07-26T12:21:11Z"
    },
    "predecessor_control": {
      "type": "object",
      "additionalProperties": false,
      "required": [
        "prior_run_contract_sha256",
        "eighth_attempt_ledger_sha256",
        "eighth_attempt_ledger_schema_sha256",
        "prior_failed_workflow_head_shas",
        "prior_failed_head_dispatches_after_freeze",
        "prior_failed_head_reruns_after_freeze"
      ],
      "properties": {
        "prior_run_contract_sha256": {
          "const": "88c19bfb0c95b1ba75d47738899b04f648eb6c53b2bbc0ed217749d72154e0a7"
        },
        "eighth_attempt_ledger_sha256": {
          "const": "092f5a580d905213066a99221f51b9065748dceeb82e48e20b54ed42e82d444f"
        },
        "eighth_attempt_ledger_schema_sha256": {
          "const": "2945fb030f4154da1d18142f5b239a5b824126010d8dbcc9ae92b7a973f089ab"
        },
        "prior_failed_workflow_head_shas": {
          "type": "array",
          "minItems": 8,
          "maxItems": 8,
          "uniqueItems": true,
          "items": {
            "type": "string",
            "pattern": "^[0-9a-f]{40}$"
          }
        },
        "prior_failed_head_dispatches_after_freeze": {
          "const": 0
        },
        "prior_failed_head_reruns_after_freeze": {
          "const": 0
        }
      }
    },
    "attempts": {
      "type": "array",
      "minItems": 1,
      "maxItems": 1,
      "items": {
        "type": "object",
        "additionalProperties": false,
        "required": [
          "sequence",
          "delivery",
          "workflow",
          "jobs",
          "public_failure",
          "effects",
          "scope_activation",
          "live_protocol_ab",
          "diagnosis"
        ],
        "properties": {
          "sequence": {
            "const": 9
          },
          "delivery": {
            "type": "object",
            "additionalProperties": false,
            "required": [
              "kind",
              "pull_request_number",
              "pull_request_head_sha",
              "merge_commit_parent_sha",
              "merge_commit_sha",
              "merged_at_utc",
              "merge_precondition",
              "redundant_post_merge_ci_cancelled"
            ],
            "properties": {
              "kind": {
                "const": "CONTROLLED_MOOMOOAU_PR"
              },
              "pull_request_number": {
                "const": 126
              },
              "pull_request_head_sha": {
                "const": "f82d9ecd99aa809fd8a27d3323bf7fdffca7bf45"
              },
              "merge_commit_parent_sha": {
                "const": "c3acc31eda47505bf07b9cf7e53cd0391e229f5d"
              },
              "merge_commit_sha": {
                "const": "6f82e738611e0d2eeeadd2507f738c9e269c91e0"
              },
              "merged_at_utc": {
                "const": "2026-07-26T11:58:01Z"
              },
              "merge_precondition": {
                "const": "TARGETED_INSTANT_VALIDATION_NO_WALL_CLOCK_SOAK"
              },
              "redundant_post_merge_ci_cancelled": {
                "const": true
              }
            }
          },
          "workflow": {
            "type": "object",
            "additionalProperties": false,
            "required": [
              "run_id",
              "run_url",
              "workflow_id",
              "event",
              "workflow_ref",
              "workflow_head_sha",
              "run_attempt",
              "reruns",
              "started_at_utc",
              "completed_at_utc"
            ],
            "properties": {
              "run_id": {
                "const": 30201167052
              },
              "run_url": {
                "const": "https://github.com/LinzeColin/MetaDatabase/actions/runs/30201167052"
              },
              "workflow_id": {
                "const": 318812500
              },
              "event": {
                "const": "workflow_dispatch"
              },
              "workflow_ref": {
                "const": "refs/heads/main"
              },
              "workflow_head_sha": {
                "const": "6f82e738611e0d2eeeadd2507f738c9e269c91e0"
              },
              "run_attempt": {
                "const": 1
              },
              "reruns": {
                "const": 0
              },
              "started_at_utc": {
                "const": "2026-07-26T11:59:05Z"
              },
              "completed_at_utc": {
                "const": "2026-07-26T12:05:05Z"
              }
            }
          },
          "jobs": {
            "type": "object",
            "required": [
              "authority_gate",
              "ga_schedule_rehearsal",
              "identity_plaintext_cleanup",
              "live_schedule_hold"
            ]
          },
          "public_failure": {
            "type": "object",
            "required": [
              "schema_version",
              "status",
              "reason_code",
              "failure_phase",
              "installation_token_failure_class",
              "exact_root_cause_claimed",
              "protected_values_disclosed"
            ],
            "properties": {
              "schema_version": {
                "const": "moomooau.protected-ga-public-failure.v1"
              },
              "status": {
                "const": "BLOCKED"
              },
              "reason_code": {
                "const": "PROTECTED_GA_FIRST_IMPORT_POINTER_FETCH_FAILED"
              },
              "failure_phase": {
                "const": "FIRST_IMPORT_POINTER_FETCH"
              },
              "installation_token_failure_class": {
                "const": "UNCLASSIFIED"
              },
              "exact_root_cause_claimed": {
                "const": false
              },
              "protected_values_disclosed": {
                "const": false
              }
            }
          },
          "effects": {
            "type": "object",
            "required": [
              "matching_private_repositories",
              "private_repository_head_changed",
              "private_repository_new_commits_during_attempt",
              "gmail_source_mutations",
              "gmail_mutation_api_reached",
              "identity_plaintext_cleanup",
              "one_shot_authority_variable_after_dispatch",
              "production_enablement_variable_after_dispatch",
              "exact_private_locator_disclosed"
            ],
            "properties": {
              "matching_private_repositories": {
                "const": 1
              },
              "private_repository_head_changed": {
                "const": false
              },
              "private_repository_new_commits_during_attempt": {
                "const": 0
              },
              "gmail_source_mutations": {
                "const": 0
              },
              "gmail_mutation_api_reached": {
                "const": false
              },
              "identity_plaintext_cleanup": {
                "const": "PASS"
              },
              "one_shot_authority_variable_after_dispatch": {
                "const": "ABSENT"
              },
              "production_enablement_variable_after_dispatch": {
                "const": "ABSENT"
              },
              "exact_private_locator_disclosed": {
                "const": false
              }
            }
          },
          "scope_activation": {
            "type": "object",
            "additionalProperties": false,
            "required": [
              "owner_confirmed_app_link_retained",
              "runtime_exact_installation_repository_scope",
              "new_private_repository_created",
              "new_github_app_created",
              "private_repository_locator_disclosed"
            ],
            "properties": {
              "owner_confirmed_app_link_retained": {
                "const": true
              },
              "runtime_exact_installation_repository_scope": {
                "const": "PASS_BEFORE_GMAIL_CREDENTIAL_EXCHANGE"
              },
              "new_private_repository_created": {
                "const": false
              },
              "new_github_app_created": {
                "const": false
              },
              "private_repository_locator_disclosed": {
                "const": false
              }
            }
          },
          "live_protocol_ab": {
            "type": "object",
            "additionalProperties": false,
            "required": [
              "current_pointer_bucket",
              "contents_metadata_shape",
              "contents_raw_media_http_status",
              "contents_raw_media_canonical_age_size_sha",
              "git_blob_api_encoding_sha_size_age",
              "patched_production_adapter_recovery",
              "raw_media_failure_body_class",
              "exact_private_locator_disclosed",
              "exact_private_path_disclosed",
              "exact_source_identifier_disclosed"
            ],
            "properties": {
              "current_pointer_bucket": {
                "const": "MULTIPLE"
              },
              "contents_metadata_shape": {
                "const": "ALL_PASS"
              },
              "contents_raw_media_http_status": {
                "const": "ALL_200"
              },
              "contents_raw_media_canonical_age_size_sha": {
                "const": "PARTIAL_ONE_FAILED"
              },
              "git_blob_api_encoding_sha_size_age": {
                "const": "ALL_PASS"
              },
              "patched_production_adapter_recovery": {
                "const": "ALL_PASS"
              },
              "raw_media_failure_body_class": {
                "const": "NON_AGE_NON_CANONICAL_BINARY"
              },
              "exact_private_locator_disclosed": {
                "const": false
              },
              "exact_private_path_disclosed": {
                "const": false
              },
              "exact_source_identifier_disclosed": {
                "const": false
              }
            }
          },
          "diagnosis": {
            "type": "object",
            "required": [
              "observable_failure_boundary",
              "exact_protected_runtime_exception",
              "reproduced_root_cause",
              "root_cause_basis",
              "safe_next_action",
              "basis"
            ],
            "properties": {
              "observable_failure_boundary": {
                "const": "WITHIN_FIRST_IMPORT_POINTER_FETCH_BEFORE_POINTER_DECRYPT_OR_ANY_NEW_PROCESSED_WRITE_OR_GMAIL_MUTATION"
              },
              "exact_protected_runtime_exception": {
                "const": "NOT_RECEIVED_OR_INSPECTED"
              },
              "reproduced_root_cause": {
                "const": "CONTENTS_RAW_MEDIA_RETURNED_NON_CANONICAL_BODY_FOR_ONE_CURRENT_POINTER"
              },
              "root_cause_basis": {
                "const": "LIVE_REPRODUCED_SAME_PRODUCTION_ADAPTER_AND_UNCHANGED_REMOTE_HEAD"
              },
              "safe_next_action": {
                "const": "NEW_EXACT_HEAD_CANONICAL_GIT_BLOB_RECOVERY_REHEARSAL"
              },
              "basis": {
                "type": "array",
                "minItems": 7,
                "maxItems": 7,
                "items": {
                  "type": "string",
                  "minLength": 1
                }
              }
            }
          }
        }
      }
    },
    "completion_policy": {
      "type": "object",
      "additionalProperties": false,
      "required": [
        "same_head_rerun_allowed",
        "failed_head_redispatch_allowed",
        "frozen_failed_workflow_head_shas",
        "exact_canonical_git_blob_candidate_allowed",
        "next_candidate_dispatch_limit",
        "historical_ga_rehearsal_dispatches_consumed",
        "historical_ga_rehearsal_reruns",
        "t0705_complete",
        "t0706_authorized",
        "final_publication_authorized"
      ],
      "properties": {
        "same_head_rerun_allowed": {
          "const": false
        },
        "failed_head_redispatch_allowed": {
          "const": false
        },
        "frozen_failed_workflow_head_shas": {
          "type": "array",
          "minItems": 9,
          "maxItems": 9,
          "uniqueItems": true,
          "items": {
            "type": "string",
            "pattern": "^[0-9a-f]{40}$"
          }
        },
        "exact_canonical_git_blob_candidate_allowed": {
          "const": true
        },
        "next_candidate_dispatch_limit": {
          "const": 1
        },
        "historical_ga_rehearsal_dispatches_consumed": {
          "const": 9
        },
        "historical_ga_rehearsal_reruns": {
          "const": 0
        },
        "t0705_complete": {
          "const": false
        },
        "t0706_authorized": {
          "const": false
        },
        "final_publication_authorized": {
          "const": false
        }
      }
    },
    "claims": {
      "type": "object",
      "additionalProperties": false,
      "required": [
        "s7ac_005_passed",
        "production_health",
        "final_acceptance",
        "stage7_complete"
      ],
      "properties": {
        "s7ac_005_passed": {
          "const": false
        },
        "production_health": {
          "const": false
        },
        "final_acceptance": {
          "const": false
        },
        "stage7_complete": {
          "const": false
        }
      }
    }
  }
}
